{"artifact_class":"candidate-direction-instrumentation","case_summary":{"domains_by_label":{"segmentation":["manufacturing","packaging"]},"label_counts":{"segmentation":2},"total":2},"claim_ids":[],"contrast_label":"inversion","empirical":false,"evidence_eligible":false,"gates":[{"details":"Lab 04 predecessor integrity and scientific readiness pass","gate":"D1","status":"fail"},{"details":"case/representation integrity and label separation hold","gate":"D2","status":"pass"},{"details":"target and contrast meet the case minimum","gate":"D3","status":"fail"},{"details":"target and contrast meet the domain minimum","gate":"D4","status":"fail"},{"details":"non-zero candidate directions are available","gate":"D5","status":"fail"},{"details":"seeded random controls are norm-matched","gate":"D6","status":"fail"},{"details":"unrelated-label controls are available","gate":"D7","status":"fail"},{"details":"no dense vectors, interventions, or causal claims are published","gate":"D8","status":"pass"}],"hashes":{"cases_jsonl":"cdad236772ba01d090c9749eac5522b2295c21d0ed6ab4f9430e80477df08a9c","config_json":"d2103b21f9979982847c0f8f96957ab128e8f508cc39d74d4ef6913bf8f24024","direction_result_json":"ebe093cf1bea84d297441fd51ea4ec71859b2b46cb2cf7a66ef34a4d9ad73b03","predecessor_lab04_summary":"c077033dd7b40e4e50d3b755adf5ccc89ddf236e77135cd21dec192d93f4a5ad","report_html":"afc949038b2b19daa7a02492db33965c92ce885ba1d25ef0d5538408a38990f9","representations_jsonl":"a2363cbf4439882a699de1abd1833a946f741592f49e34445f6a8dc3c13a4955","summary_json":"1dbd3ddff0f103a7d9e27dc0f0b35f7d355dabaf9d0e166b8a353c6f41717c76"},"input_hashes":{"cases_jsonl":"cdad236772ba01d090c9749eac5522b2295c21d0ed6ab4f9430e80477df08a9c","config":"d2103b21f9979982847c0f8f96957ab128e8f508cc39d74d4ef6913bf8f24024","representations_jsonl":"a2363cbf4439882a699de1abd1833a946f741592f49e34445f6a8dc3c13a4955"},"interpretation":"diagnostic_only_not_scientifically_interpretable","issues":["Lab 04 predecessor is present and integrity-checked but not scientifically ready","a non-zero candidate direction is unavailable for one or more layers","norm-matched seeded random controls are unavailable","one or more unrelated-label controls are unavailable","target/contrast case minimum is not met","target/contrast domain minimum is not met"],"layers":[{"candidate_direction":{"available":false,"contrast_mean_projection":null,"l2_norm":0.0,"target_mean_projection":null,"unit_vector_sha256":""},"case_count":2,"layer_index":0,"norm_matched_random_controls":{"available":false,"controls":[],"norm_match_tolerance":1e-12},"unrelated_label_controls":[{"available":false,"cosine_to_candidate":null,"label":"merging","unit_vector_sha256":""},{"available":false,"cosine_to_candidate":null,"label":"universality","unit_vector_sha256":""}]},{"candidate_direction":{"available":false,"contrast_mean_projection":null,"l2_norm":0.0,"target_mean_projection":null,"unit_vector_sha256":""},"case_count":2,"layer_index":1,"norm_matched_random_controls":{"available":false,"controls":[],"norm_match_tolerance":1e-12},"unrelated_label_controls":[{"available":false,"cosine_to_candidate":null,"label":"merging","unit_vector_sha256":""},{"available":false,"cosine_to_candidate":null,"label":"universality","unit_vector_sha256":""}]}],"predecessor":{"details":"Lab 04 is integrity-checked but its scientific readiness status is fail","integrity_verified":true,"scientifically_ready":false,"status":"fail","summary_sha256":"c077033dd7b40e4e50d3b755adf5ccc89ddf236e77135cd21dec192d93f4a5ad"},"publication_boundary":{"causal_claim_allowed":false,"dense_vectors_published":false,"interventions_executed":false,"steering_claim_allowed":false},"seed_policy":[1729,1730,1731],"status":"fail","summary_artifacts":{"direction_result":"direction_result.json","generated_by":"lab05_candidate_direction_runner","html":"report.html","readiness_statement":"Candidate directions are descriptive diagnostics, not causal or steering evidence.","summary":"summary.json"},"target_label":"segmentation","unrelated_labels":["merging","universality"]}